"Carla Lisiane de Oliveira Castanho","A Avaliação do Uso de Chatterbots no Ensino Através de uma Ferramenta de Autoria"
"Carlos Eduardo Ávila","AMonMEF – Um Agente de Interface para Avaliação de Aprendizagem em Ensino a Distância"
"Carlos Fernando Araújo Jr","Design Patterns for Learning Objects:  the Case for Socratic Method"
"Carlos Franco","Mapa do Zoológico – Captura Cognitiva para Disfunção Executiva"
"Carlos H. C. Ribeiro","Utilização de Aprendizagem por Reforço para Modelagem Autônoma do Aprendiz em um Tutor Inteligente"
"Carlos J. P. de Lucena","Coordenação de Fóruns Educacionais:  Encadeamento e Categorização de Mensagens"
"Carlos José M. Olguín","Coordenação de Atividades em Ambientes de Aprendizagem Colaborativos"
"Carlos José Pereira de Licena","Formação de Grupos no Ambiente AulaNet Utilizando Agentes de Software"
"Carlos Lopes","Geração Automática de currículo para um Sistema Educacional Baseado na Web"
"Carlos Miguel Tobar","Uma Arquitetura de Ambiente Colaborativo para o Aprendizado de Programação"
"Carlos R. Lopes","Uma Ferramenta de Autoria para um Sistema Educacional Apoiado na Web"
"Carlos Renato dos Santos Ramos","Análise de agrupamento de escolas e Núcleos de Tecnologia Educacional: mineração na base de dados de avaliação do Programa Nacional de Informática na Educação"
"Carlos Roberto França","TUPI – Recursos de Acessibilidade para Educação Especial e Inclusiva dos Deficientes Motores"
"Carlos Villalba","A Suite of Authoring Tools for the Design of Structural Communication Activities in Web-Based Environments"
"Carmem R. D. Nogueira","Guilly - Um Agente Pedagógico Animado para o AVEI"
"Carolina M. de Carvalho","Controle Inteligente de Tempo Livre em Tutoria Multissessão: Concepção, Implementação e Avaliação Empírica"
"Caroline Kraus Luvizotto","A Transmissão da Tradição Gaúcha e o Processo Ensino-aprendizagem Utilizando Ferramentas da Web 2.0"
"Cássia T. dos Santos","AVA: Um Ambiente Virtual Baseado em Comunidades"
"Cassiano Dal Pizzol","O RPG como técnica na construção de software educacional: A Revolução Farroupilha."
"Cássio David Borralho Pinheiro","LVR – Laboratório Virtual de Redes - Protótipo para Auxílio ao Aprendizado em Disciplinas de Redes de Computadores"
"Cássio Prazeres","Processo de Modelagem de Resposta: Refinando Requisitos de Software de Apoio a Laboratórios de Acesso Remoto"
"Cecilia D. Flores","Agente mediador para seleção de estratégias pedagógicas em um ambiente multiagente de aprendizagem"
"Cecília D. Flores","Ensino de medicina apoiado pelo processamento de exames médicos baseados em imagem"
"Cecília Dias Flores","Aplicação de estratégias de construção de conhecimento em um ambiente probabilístico de aprendizagem"
"Célia G. Ralha","Aprendizagem de Língua Assistida por Computador: Uma Abordagem Baseada em HPSG"
"Célia Regina Rangel Nascimento","Dimensão Sócio-Afetiva da Interação à Distância"
"Celso Hartmann","Linguagem e Ferramenta de Autoria para Promover o Desenvolvimento de Perícias em Xadrez"
"Cesar Augusto Camillo Teixeira","Mais pontes e menos ilhas Estratégias para a integração de software educacional"
"César Lincoln C. Mattos","Acesso Remoto e Compartilhamento de Simuladores através de Ambientes Virtuais de Aprendizagem"
"Cesar Teixeira","Processo de Modelagem de Resposta: Refinando Requisitos de Software de Apoio a Laboratórios de Acesso Remoto"
"Christine S. Schröeder","Assistente Inteligente tendo como Apoio um Ambiente de Ensino a Distância"
"Cícero C. Quarto","Considerando os fatores sócio-afetivos personalidade e liderança em ambientes de ensino-aprendizagem colaborativos assistidos por computador"
"Claiton de Oliveira","NA-WEB: Um Sistema Interativo para Aprendizagem de Métodos Numéricos via Web"
"Clara Coutinho","M-Learning e Webquests: as novas tecnologias como recurso pedagógico"
"Clarindo Isaías Pereira da Silva e Pádua","MAQSEI - uma Metodologia de Avaliação de Qualidade de Software Educacional Infantil"
"Claudia Boeres","Comparando mapas conceituais utilizando correspondência de grafos"
"Cláudia C. Pérez","AVA: Um Ambiente Virtual Baseado em Comunidades"
"Cláudia M. Ribeiro Andrade","Primeiros Passos de um Processo de Exercício da Cidadania com uso da Informática"
"Claudia Regina Uchoa de Lima","Acessibilidade Tecnológica e Pedagógica na Apropriação das Tecnologias de Informação e Comunicação por Pessoas com Necessidades Educacionais Especiais"
"Cláudia Zamboni de Almeida","Ambiente Virtual de Aprendizagem: uma proposta para autonomia e cooperação na disciplina de informática"
"Cláudio Fernando Resin Geyer","Javal – ambiente para avaliações remotas em Ensino à Distância empregando agentes embarcados"
"Cláudio Ferretti","ODAI - Objetos Digitais para Aprendizagem Interacionista"
"Cláudio Kirner","Universalizando a Interface Computacional com Realidade Aumentada para a Inclusão de Deficientes Visuais e Auditivos"
"Cláudio N. Rapello","Desenvolvimento e Aplicação de um Software como Ferramenta Motivadora no Processo Ensino-Aprendizagem de Química"
"Cleberson E. Forte","LIDRA - LIVRO DIDÁTICO COM REALIDADE AUMENTADA"
"Cleberson Forte","Universalizando a Interface Computacional com Realidade Aumentada para a Inclusão de Deficientes Visuais e Auditivos"
"Clevi Elena Rapkiewicz","Construindo o Módulo do Domínio de um Assistente Inteligente Utilizando a Ferramenta Java Expert System Shell"
"Clodis Boscarioli","Avaliando a Ferramenta xLupa como recurso para a Educação Especial Inclusiva"
"Clovis T. Fernandes","Proposta de Repositório Inteligente para Jogos Cooperativos Educacionais"
"Credine Silva de Menezes","MEDIADOR - Um ambiente para aprendizagem orientada a projetos com suporte inteligente à mediação"
"Creto Augusto Vidal","A Tour Guide Course using Collaborative Virtual Environments"
"Cristiane da Silva Gabriel","A gênese de uma comunidade virtual de aprendizagem em enfermagem"
"Cristiane Gabriel","Associação entre a colaboração/cooperação e a conversação em uma comunidade virtual de enfermagem"
"Cristiane Guimarães","Desenvolvimento de Ambientes de Aprendizagem Cooperativa na Web"
"Cristiane M. Cruz","Modelo de Desenvolvimento de Objetos de Aprendizagem Baseado em Metodologias Ágeis"
"Cristiane R. Woszezenski","Guilly - Um Agente Pedagógico Animado para o AVEI"
"Cristiano Melonio","Uma proposta para o desenvolvimento de um interpretador para aLíngua Brasileira de Sinais"
"Cristina Schwarz","Rede de Cooperação Digital: desenvolvimento das comunidades de baixa renda num cenário de Novas Tecnologias da Informação e Comunicação"
"Cyntia F. Santos","Plataforma Interativa para Internet (PII): Resultados de uma Proposta de Pesquisa-Ação"
"Daltro José Nunes","Processo de Curso: Uma Abordagem para EaD baseada na Tecnologia de Processo de Software"
"Dalvares R. de Oliveira","Sign WebEDIT: uma oportunidade para a criação coletiva de textos escritos em Língua de Sinais"
"Daniel Damas Guardanapo","Padrões de interação/comunicação em uma comunidade virtual de enfermagem"
"Daniel dos Santos Pêgas","O uso de data warehousing no processo de aprendizagem de programação"
"Daniel Monegatto Santoro","A Sinergia entre as Heurísticas de Usabilidade de Software e as Heurísticas de Ensino - Aprendizagem do ponto de vista da Educação à Distância Mediada pela Web"
"Daniel Westerlund","Entendendo as Relações entre Compilador, Arquitetura e Organização com o Simulador do MIPS I Gerado por um Framework de Modelagem"
"Daniel William","An Online Multimedia System for Learning to Design User Interfaces"
"Daniel William Tavares Rodrigues","A importância do Projeto da Interação Humana Centrado na Comunidade para melhorar a Usabilidade e Sociabilidade em Fóruns de Discussão"
"Daniela Debastiani de Souza","O Vídeo Digital e a Educação"
"Daniela Maiocchi","SIGNHQ: sistema de autoria para criação e leitura de Histórias em Quadrinhos com suporte à Língua de Sinais"
"Daniela Peño Paiva","ERA UMA VEZ... uma narrativa em co-autoria no espaço virtualco-autoria em narrativa coletivas intersecionadas por tecnologias digitais"
"Daniela Rossi","Sign WebForum: um Fórum de Discussão que Utiliza a Troca de Mensagens em Libras na Web"
"Daniela Stevanin Hoffmann","Experiências física e lógico-matemática em Espaço e Forma: uma arquitetura pedagógica de uso integrado de recursos manipulativos digitais e não-digitais"
"Dante Augusto Couto Barone","FORMAÇÃO DE GRUPOS COLABORATIVOS UTILIZANDO ALGORITMOS GENÉTICOS"
"Débora N. F. Barbosa","Uma proposta de agente pedagógico pessoal pervasivo -consciência do contexto e da mobilidade do aprendiz"
"F. M. de Azevedo","IMPLEMENTAÇÃO DINÂMICA DE ATIVIDADES NUM SISTEMA TUTOR INTELIGENTE"
"Fernanda Maria Pereira Freire","Contribuições de conceitos de comunicação mediada por computadores e visualização de informação para o desenvolvimento de ambientes de aprendizagem colaborativa"
"Fernando A. O. O. Gauthier","Learning Companions no Ensino a Distância"
"Fernando da Fonseca de Sousa","Three-dimensional Virtual Environments Adaptive to the Student's Profile for Distance Learning"
"Fernando da Fonseca de Souza","Um Ambiente Telemático para Mediar a Controvérsia Acadêmica"
"Fernando G. da Silvera Junior","Um Ambiente Lúdico de Ensino e Aprendizagem de Matemática Fundamental em Plataforma Web"
"Fernando Hartmann","ERA UMA VEZ... uma narrativa em co-autoria no espaço virtualco-autoria em narrativa coletivas intersecionadas por tecnologias digitais"
"Fernando Lincoln Mattos","A importância do Projeto da Interação Humana Centrado na Comunidade para melhorar a Usabilidade e Sociabilidade em Fóruns de Discussão"
"Fernando Mendes de Azevedo","Metodologia para desenvolvimento de um site com interface adaptativa usando redes neurais e a teoria das Inteligências Múltiplas"
"Fernando Santos Osório","Um Ambiente Virtual Inteligente e Adaptativo para a Educação a Distância"
"Fernando Schnaid","Implementação de Sistema Tutor Inteligente para Geotecnia"
"Fernando Schrimbeck","Comunidades Virtuais de Formação Tecnológica: Fundamentação Pedagógica e Metodologia de Construção"
"Fernando Varella","Uma Proposta de Arquitetura Interoperável  integrando Web, TV Digital e Dispositivos Móveis"
"Flávia A. Barros","Projeto FIACI: Concepção de Ferramentas Inteligentes para Aprendizagem Cooperativa na Internet"
"Flávia Daniela","Inclusão Sócio-Digital para a Cidadania: A Utilização de Projetos Práticos na Formação Tecnológica"
"Flávia M. Santoro","Estimulando a Participação em um Ambiente Virtual de Aprendizagem Colaborativa"
"Flávia Maria Santoro","Um Modelo de Cooperação para Aprendizagem Baseada em Projetos com Foco no Processo Cooperativo e Workflow"
"Flavia Rezende","FORMAÇÃO CONTINUADA A DISTÂNCIA DE PROFESSORES DE FÍSICA DO NÍVEL MÉDIO:  DESENVOLVIMENTO E AVALIAÇÃO DE UM CURSO PILOTO  COM SUPORTE NA INTERNET"
"Flávia Veloso de Souza","Análise da Atividade Assíncrona na interação via Lista de Discussão: estudo de caso em curso de formação continuada de professores em regime semipresencial"
"Flaviana S. Silva","A Internet no contexto escolar: uma mídia pedagógica para promover a inclusão digital e social de alunos do ensino fundamental"
"Flávio Bortolozzi","Interações Argumentativas em  Ambientes Virtuais de Aprendizagem"
"Flávio Galdino Xavier","A Modelagem Computacional, Utilizando o Laboratório deAprendizagem Experimental com Animação para o Pensamento Sistêmico (STELLA), em Tópicos de Educação Ambiental"
"Flávio Lamas","Comparando mapas conceituais utilizando correspondência de grafos"
"Flávio M. Vaz da Costa","Aprendizagem de Língua Assistida por Computador: Uma Abordagem Baseada em HPSG"
"Flávio Mota Medeiros","FA_PorT: Um Framework para Sistemas Portfólio-Tutor utilizando Agentes"
"Franciele C. Petry","Assistente Inteligente tendo como Apoio um Ambiente de Ensino a Distância"
"Francine Ferreira Vaz","Sites Educacionais Construtivistas: como selecionar?"
"Francine Vaz","Jogos Inteligentes são Educacionais?"
"Francisco Araújo de Almeida Neto","Utilizando o Método Clínico Piagetiano para Acompanhar a Aprendizagem de Programação"
"Francisco C. Oliveira","LIDRA - LIVRO DIDÁTICO COM REALIDADE AUMENTADA"
"Francisco César de Oliveira","Universalizando a Interface Computacional com Realidade Aumentada para a Inclusão de Deficientes Visuais e Auditivos"
"Francisco Edson Lopes da Rocha","Especificação de um Algoritmo Genetico para Auxiliar na Avaliação da Aprendizagem Significativa com Mapas Conceituais"
"Francisco José de Azevedo Alves","ADeCUI: sistema de análise da qualidade da interface de softwares educativos baseado em modelo construtivista de cognição"
"Francisco José Martins","jXChat - Um Sistema de Comunicação Eletrônica Inteligente para apoio a Educação a Distância"
"Francisco M. Bieniacheski","Interações Argumentativas em  Ambientes Virtuais de Aprendizagem"
"Francisco Ramos de Melo","Generalizador Neural de Espaços de Aprendizagem em Sistemas Tutores Inteligentes"
"Frederico Andros da Silva","ECoDI: A criação de um Espaço de Convivência Digital Virtual"
"Frederico Moreira Bublitz","Um Arcabouço de Software Livre baseado em Componentes para a Construção de Ambientes de Comunidades Virtuais de Aprendizagem na Web"
"Frederico Oliveira Tosta","Redes neuronais e transtornos de aprendizagem: rastreio de pessoas com dislexia"
"Frederico Vilela","Processo de Prototipação da Interação em STI que Utiliza a Aprendizagem Baseada em Problemas como Proposta Pedagógica"
"FulanoRenato Cardoso Mesquita","UM MODELO INFORMACIONAL PARA AVALIAÇÕES DE ALUNOS NO ENSINO A DISTÂNCIA VIA WEB"
"G. M. da Nobrega","Uma abordagem assíncrona à modelagem colaborativa"
"G. M. da Nóbrega","Capturando experiência docente para guiar o processo de design instrucional colaborativo e contínuo"
"G. M. J. Curilem","IMPLEMENTAÇÃO DINÂMICA DE ATIVIDADES NUM SISTEMA TUTOR INTELIGENTE"
"G. Ramos","Avaliação de grupos de discussão segundo conceitos de Comunidades de Prática"
"Gabriel André D. Dubois Brito","Sistema ROSA - P2P: uma Arquitetura Distribuída para Integração de Objetos de Aprendizagem"
"Geber Lisboa Ramalho","Desenvolvimento de um Software Educacional com base em Conceitos de Jogos de Computador"
"Genésio Gomes da Cruz Neto","Elicitação de Requisitos de Sistemas Colaborativos de Aprendizagem Centrada na Atividade de Grupo"
"Genessa Robinson","Modelando Requisitos Especificados com Mapas conceituas através da UML-MC"
"Gentil J. Lucena Filho","Comunidades virtuais de aprendizagem: novas dinâmicas de aprendizagem exigem novas formas de avaliação"
"Gentil Serra Jr","Recuperação de Informações Web para um Ambiente de Aprendizagem Computadorizada: uma Abordagem Multiagentes"
"Gerardo S. Viana Júnior","Portal Humanas: Um ambiente colaborativo para criação de projetos e comunidades virtuais para a área de Humanidades"
"Gerd Wagner","Help&Learn: A Peer-to-Peer Architecture to Support Knowledge Management in Collaborative Learning Communities"
"Germana M. da Nóbrega","Rumo a um ambiente de apoio ao estudante no auto-planejamento de seu processo de aprendizagem"
"Germana Menezes da Nóbrega","A Contradiction-driven Approach of Learning in Discovery Learning Environments"
"Germano de Souza Keinbaum","O APRENDIZADO A DISTÂNCIA ATRAVÉS DE UM AMBIENTE COMPUTACIONAL INTELIGENTE PARA EDUCAÇÃO NA WEB"
"Gianna Oliveira Roque","Uma ferramenta para avaliação de competência baseada no desenvolvimento de projeto"
"Gilbert Breves Martins","Objetos de Aprendizagem: Uma Experiência de Integração com um Ambiente Telemático"
"Gilberto Pedro da Silva Júnior","Sumarização de Texto em Ambientes Educacionais na Web"
"Gilda A. de Assis","Avaliação de Aceitabilidade de um Computador Portátil de Baixo Custo por Criança"
"Gilda Aparecida de Assis","EducaTrans: um Jogo para Educação no Trânsito"
"Gilse Antoninha Morgental Falkembach","A BRUXARIA: atividades digitais voltadas para a Pré-escola"
"Gino Piccolo","Um Ambiente para o Ensino de Leitura baseado na Pesquisa em Equivalência e Controle por Unidades Mínimas"
"Gisele Trentin da Silva","Adaptação em um Sistema Educacional Hipermídia baseada na Classificação de Perfis de Usuários"
"Gisleide A. M. Werneck","Investigando as Contribuições do Uso de Scaffolds no Domínio Educacional"
"Gláucia da Silva Brito","FORMAÇÃO CONTINUADA EM AMBIENTE VIRTUAL DE APRENDIZAGEM: ELEMENTOS REVELADORES DA EXPERIÊNCIA DE PROFESSORES DA EDUCAÇÃO BÁSICA"
"Gláucia Sá Fortes Moreira","CardioCaseDiscussion: um ambiente virtual de aprendizagem cooperativa"
"Gláucio Almeida","Modelando um ambiente de aprendizagem na Web: a importância de formalização do processo de desenvolvimento"
"Glaucio J. C. Machado","Guilly - Um Agente Pedagógico Animado para o AVEI"
"Graçaliz P. Dimuro","Comunidades Virtuais de Formação Tecnológica: Fundamentação Pedagógica e Metodologia de Construção"
"Gretchen Torres de Macêdo","Objetos de Aprendizagem: Uma Experiência de Integração com um Ambiente Telemático"
"Gudelia Morales","Construindo o Módulo do Domínio de um Assistente Inteligente Utilizando a Ferramenta Java Expert System Shell"
"Guilherme Bittencourt","Uma Arquitetura Multiagente para Suporte ao Aprendizado em Grupo em Sistemas Tutores Inteligentes"
"Guilherme Drehmer","Um Sistema de Aprendizagem de Demonstrações da Geometria Euclidiana Plana - LEEG"
"Guilherme S. dos Santos","Sign WebEDIT: uma oportunidade para a criação coletiva de textos escritos em Língua de Sinais"
"Gustavo A. Giménez Lugo","Respeitando a Diversidade da Inteligência Comunitária: agentes inteligentes Peer-to-Peer como mediadores em processos comunitários de partilha e aprendizagem"
"Gustavo Hermínio Araújo","Controle de Kit de Robótica através de Laboratório Remoto pela Internet: uma Aplicação para a Formação Docente e para a Educação Básica"
"Gustavo Morceli","Almanaque Mundial de Tecnologias Educacionais (AMTE)"
"Gustavo Pereira Mateus","Uma ferramenta de análise do desempenho de estudantes baseada em SMA e lógica Fuzzy"
"Gustavo Simonato","Investigando a subjetividade afetiva na comunicação assíncrona de ambientes virtuais de aprendizagem"
"Gustavo Vier","Metodologia de Construção do Material Instrucional em um Ambiente de Ensino Inteligente na Web"
"Hamid Chaachoua","O PAPEL DE UM AMBIENTE COMPUTACIONAL DE ENSINO NA MODELAGEM DE CONCEPÇÕES DOS ALUNOS: O CASO DA SIMETRIA ORTOGONAL"
"Hannah Sabaini de Sá","Trabalho com Alunos Multiplicadores para Aplicação de Objetos de Aprendizagem no Ensino Curricular"
"HansJorg Andreas Schneebeli","Um Ambiente para Simulação e Animação de Robôs"
"Heitor Augustus Xavier Costa","TBC-SO/WEB: Um Software Educacional para o Ensino de Políticas de Escalonamento de Processos e de Alocação de Memória em Sistemas Operacionais"
"Helder Coelho","Agente mediador para seleção de estratégias pedagógicas em um ambiente multiagente de aprendizagem"
"Helena Sporleder Côrtes","O Uso da Internet pelos Professores da Educação Infantil no Desenvolvimento da Educação Ambiental"
"Helika A. Chikuchi","Estudo Exploratório sobre o Interesse dos Professores de Biologia do Ensino Médio Cadastrados em uma Biblioteca Digital de Ciências"
"José Antonio Gameiro Salles",""SEMINÁRIO DE EDUCAÇÃO A DISTÂNCIA NA ÁREA DA SAÚDE": UMA EXPERIÊNCIA DE APRENDIZAGEM ONLINE"
"Josué de Araújo","Uma proposta para o desenvolvimento de um interpretador para aLíngua Brasileira de Sinais"
"Josué J. G. Ramos","Implementação de Compilador e Ambiente de Programação Icônica para a Linguagem Logo em um Ambiente de Robótica Pedagógica de Baixo Custo"
"Jouran P. Cortez","The Use of Conceptual Maps in a Hybrid Intelligent Tutoring System"
"Joyce M. Pernigotti","Experiência de Modelagem de Ambientes de Aprendizagem da PUCRS VIRTUAL"
"Júlia Koefender","A experiência do Projeto Classificação de Software Livre Educativo (CLASSE)"
"Juliana H. Kowata","Caracterização das Abordagens para Construção (Semi) Automática de Mapas Conceituais"
"Juliana Lucas de Rezende","Aplicando o Protocolo Social através de Mecanismos de Coordenação embutidos em uma Ferramenta de Bate-Papo"
"Juliana Miranda","Um Software de Apoio à Melhoria da Interação de Crianças com Características Autistas"
"Juliana R. B. Diniz","Utilizando a Cidade Virtual do Saber como uma Ferramenta de Aprendizagem"
"Juliano Bitencourt","AMADIS – Um Ambiente Integrado de Apoio à Pedagogia de  Projetos de Aprendizagem"
"Juliano Vargas Bittencourt","AMADIS – Um Ambiente Virtual para apoio ao Desenvolvimento de Projetos de Aprendizagem"
"Júlio Henrique Araújo Pereira Machado","Ambiente para Disponibilização de Cursos na Web Utilizando Autômatos Finitos com Saída"
"Julio Valente da Costa Jr","Especificação de um Algoritmo Genetico para Auxiliar na Avaliação da Aprendizagem Significativa com Mapas Conceituais"
"Júlio Wilson Ribeiro","A Utilização de Dispositivos Móveis com Ambientes Tridimensionais como Ferramenta para Favorecer o Ensino de Hardware"
"Junia C. Anacleto","Linguagem de Padrões para Apoiar o Projeto de Material Instrucional para e-learning"
"Junior Martins","Modelando Requisitos Especificados com Mapas conceituas através da UML-MC"
"Juracy C. Marques","Experiência de Modelagem de Ambientes de Aprendizagem da PUCRS VIRTUAL"
"Jurandy Gomes de Almeida Jr","FERRAMENTA PARA APOIO AO ENSINO DE FÍSICA BÁSICA"
"K. M. de Oliveira","Capturando experiência docente para guiar o processo de design instrucional colaborativo e contínuo"
"Karina Valdivia Delgado","An ITS for Programming to Explore Practical Reasoning"
"Karine Beschoren de Souza","Metodologia de Construção do Material Instrucional em um Ambiente de Ensino Inteligente na Web"
"Kelly Assis de Souza","GeCa - Um ambiente para apoio à criação Semi-automática de Categorias"
"Kenia Sousa","An Online Multimedia System for Learning to Design User Interfaces"
"Kimie Cadorini Nakahara","A experiência do Projeto Classificação de Software Livre Educativo (CLASSE)"
"L. Zarate","SOPHIANN: Aprendizado de Processos Através da Extração de Conhecimento via Redes Neurais"
"Laécio Nobre de Macedo","Mediação do professor e a interação entre pares em um ambiente interativo de aprendizagem"
"Laércio Ferracioli","Investigação sobre a Interação de Estudantes Universitários com o Ambiente de Modelagem Computacional Qualitativo WorldMaker"
"Larissa Tollens","Benchmark de Ambientes de Gerenciamento de Cursos a Distância"
"Laura Benedetti","HYPERMEDIA CONCEPTUAL MAPPING APPLIED TO FOREIGN LANGUAGE READING COMPREHENSION COURSES"
"Laura Maria Coutinho Lopes","Sistema de Recomendação apoiando a TVEscola"
"Lauro Eugênio Guimarães Nalini","Generalizador Neural de Espaços de Aprendizagem em Sistemas Tutores Inteligentes"
"Lauro G. Nalini","Controle Inteligente de Tempo Livre em Tutoria Multissessão: Concepção, Implementação e Avaliação Empírica"
"Leandra Anversa Fioreze","Utilização de Recursos Digitais e sua Integração na Atividade do Professor de Matemática para a Aprendizagem dos Conceitos de Proporcionalidade"
"Leandro A. P. dos Santos","A institucionalização do ROODA na UFRGS: em busca de novos espaços pedagógicos"
"Leandro L. Costalonga","Uma Proposta de Método para o Ensino de Técnicas de Composição de Música Eletrônica por Computador"
"Leandro L. Dihl","Guilly - Um Agente Pedagógico Animado para o AVEI"
"Leandro Maciel Almeida","Modelagem do Desempenho do Aprendizado de Grupos de Alunos Utilizando Data Mining"
"Leandro Magela Cunha","Suporte a Grupos de Trabalho em Turmas do Ambiente AulaNet"
"Leandro Taddeo","An Online Multimedia System for Learning to Design User Interfaces"
"Leila C. V. Andrade","Plataforma Interativa para Internet (PII): Resultados de uma Proposta de Pesquisa-Ação"
"Leliane Nunes de Barros","An ITS for Programming to Explore Practical Reasoning"
"Leonardo J. de Oliveira","SaLA: um sistema de localização para alunos e portadores de deficiências visuais baseado na teoria dos grafos e VoiceXML"
"Leonardo Madeira","AMonMEF – Um Agente de Interface para Avaliação de Aprendizagem em Ensino a Distância"
"Leonardo Magela Cunha","Formação de Grupos no Ambiente AulaNet Utilizando Agentes de Software"
"Leonidas de Oliveira Brandão","Ferramenta de Avaliação Automática no iGeom"
"Leonidas O. Brandão","Aplicações no SAW - Sistema de Aprendizagem pela Web"
"Leônidas O. Brandão","Tarefa Interativa: uma proposta flexível de interatividade para o Moodle"
"Leticia Lopes Leite","Alternativas de Ajuda On-line para Ambientes de Aprendizagem Colaborativa"
"Ligia Flávia Antunes Batista","Autoria de Diretrizes Pedagógicas Destinadas ao Treinamento das Múltiplas Capacidades da Perícia em Conceitos Visuais Complexos"
"Liliana M. Passerino","Pessoas com Autismo em Ambientes Digitais de Aprendizagem: estudo dos processos de Interação Social e Mediação"
"Lísia Rabelo","CardioCaseDiscussion: um ambiente virtual de aprendizagem cooperativa"
"Lisiane Oliveira","Guilly - Um Agente Pedagógico Animado para o AVEI"
"Livia Amorim Lopes","ProAD: Alfabetização Digital Para Jovens e Adultos"
"Lívia da Silva Neiva","Internet e Laboratório de Informática: Dois Importantes Recursos Metodológicos para Surpreender os Estudantes e Beneficiar a Interdisciplinaridade"
"Lívia Lopes Azevedo","Ambientes Computacionais Orientados a Agentes para apoio à Aprendizagem Baseada em Simulação"
"Lora Aroyo","Help&Learn: A Peer-to-Peer Architecture to Support Knowledge Management in Collaborative Learning Communities"
"Lorena Silva Camelo","Investigando a Contribuição do Software Educativo Winplot para a Compreensão do Conceito de Função"
