"Ricardo Naveiro","Learning in Context: Contextual Libraries in Architecture Distance Education"
"Ricardo Neisse","MEARA: Um Chatterbot Temático para Uso em Ambiente Educacional"
"Ricardo Pannain","Uma Arquitetura de Ambiente Colaborativo para o Aprendizado de Programação"
"Ricardo Wainer","Um Estudo Empírico dos Comportamentos de Navegação por Estilo Cognitivo de Aprendizagem em um ambiente de treinamento na Web"
"Roberto de Alencar Lotufo","Ambiente de suporte ao ensino de processamento de imagens usando a linguagem Python"
"Rodrigo Ferrugem Cardoso","AvalWeb - Sistema interativo para gerência de questões e aplicação de avaliações na Web"
"Rogério Santos Pedroso","PROJETO ESPIN: Uma Política Municipal de Implantação e Implementação das NTICs na Escola Pública"
"Romero Tavares","Metodologia de desenvolvimento de objetos de aprendizagem com foco na aprendizagem significativa"
"Romero Tori","Visualização de Objetos Moleculares: interfaces de ensino, pesquisa e extensão entre a Educação em Química e a Engenharia de Software"
"Rosana Giaretta Sguerra Miskulin","AUXILIAR: Uma aplicação de inteligência artificial que possibilita a potencialização da aprendizagem em Ambientes Colaborativos de Ensino"
"Rose Mary Almas de Carvalho","Internet: Portais Educacionais X Contexto de Aprendizagem"
"Rosinaldo Dourado da Fonseca Júnior","Utilização em Sala de Aula de um Modelo de SistemaTutor Inteligente com Recursos de Hipermídia Adaptativa"
"Rossana Andrade","A Utilização de Dispositivos Móveis com Ambientes Tridimensionais como Ferramenta para Favorecer o Ensino de Hardware"
"Thiago Senador","An Ontology-Based Digital Libraryon the e-Learning Domain"
"Thiéberson Gomes","Investigação sobre a Interação de Estudantes Universitários com o Ambiente de Modelagem Computacional Qualitativo WorldMaker"
"Sandra Freitas Ferreira Lima","A importância do Projeto da Interação Humana Centrado na Comunidade para melhorar a Usabilidade e Sociabilidade em Fóruns de Discussão"
"Sandra Maria Aluísio","Métodos de avaliação informatizada que tratam o conhecimento parcial do aluno e geram provas individualizadas"
"Sandro Neves Soares","Entendendo as Relações entre Compilador, Arquitetura e Organização com o Simulador do MIPS I Gerado por um Framework de Modelagem"
"Sarajane Marques Peres","Avaliando a Ferramenta xLupa como recurso para a Educação Especial Inclusiva"
"Sérgio Teixeira","Facilitando o uso de Ambientes Virtuais através de Agentes de Conversação"
"Sérgio Vinícius de Sá Lucena","Padrões abertos: aplicabilidade em Objetos de Aprendizagem (OAs)"
"Sidnei Alves de Araújo","Software para Auxílio à Pré-alfabetização Infantil Baseado em Reconhecimento Inteligente de Caracteres Manuscritos"
"Sílvia Dotta","Formação a distância de educadores para o diálogo virtual em serviços de tutoria on-line"
"Sílvia Ferreto da Silva Moresco","A Interação de crianças e adolescentes em Ambientes Virtuais: identificando fatores de acessibilidade e navegabilidade"
"Sílvia Isaia","Utilização de Recursos Digitais e sua Integração na Atividade do Professor de Matemática para a Aprendizagem dos Conceitos de Proporcionalidade"
"Silvia Nassar","Uma ferramenta de análise do desempenho de estudantes baseada em SMA e lógica Fuzzy"
"Sílvio César Cazella","Recomendação de Objetos de Aprendizagem Empregando Filtragem Colaborativa e Competências"
"Simone Bicca Charczuk","Metodologia de Construção do Material Instrucional em um Ambiente de Ensino Inteligente na Web"
"Sionise Rocha Gomes","Objetos de Aprendizagem Funcionais e as Limitações dos Metadados Atuais"
"Socorro Vânia Lourenço Alves","Cenários no projeto de ambientes colaborativos síncronos de aprendizagem"
"Susana Seidel","Rede de Cooperação Digital: desenvolvimento das comunidades de baixa renda num cenário de Novas Tecnologias da Informação e Comunicação"
"Susane Garrido","Avaliação de Ambientes Virtuais de Aprendizagem na perspectiva da complexidade"
"Taciana Pontual da Rocha Falcão","Cenários no projeto de ambientes colaborativos síncronos de aprendizagem"
"Tarcila Gesteira da Silva","Cal: um Agente Pedagógico Animado para Apoio em um  Objeto de Aprendizagem para o Ensino de Matemática"
"Tel Amiel","Almanaque Mundial de Tecnologias Educacionais (AMTE)"
"Telma Moretti","Educação a distância e inclusão digital: ações para a cidadania e o desenvolvimento social"
"Thereza Patrícia Pereira Padilha","Modelagem do Desempenho do Aprendizado de Grupos de Alunos Utilizando Data Mining"
"Thiago Senador","An Ontology-Based Digital Libraryon the e-Learning Domain"
"Thiéberson Gomes","Investigação sobre a Interação de Estudantes Universitários com o Ambiente de Modelagem Computacional Qualitativo WorldMaker"
"Ulrich Schiel","Portfolio-Tutor: Um Tutor acoplado a um Portfolio Eletrônico no contexto da Educação a Distância"
"Valkíria Venâncio","Avaliação de Aceitabilidade de um Computador Portátil de Baixo Custo por Criança"
"Vanderley Flor da Rosa","Peer Review e Educação Continuada a Distância utilizando o WebCoM como Ferramenta de Suporte"
"Vanessa Martins Caldas","Uma Ferramenta de Avaliação Automática para Mapas Conceituais como Auxílio ao Ensino em Ambientes de Educação a Distância"
"Vanessa Suzuki","Uma Plataforma de Teste para o Projeto Auditivo de Ambientes Virtuais 3D com Propósitos Educacionais"
"Vânia Almeida Neris","Cognitor: um Framework baseado na Linguagem de Padrões Cog-Learn"
"Vânia Paula de Almeida Néris","How Can Common Sense Support Instructors with Distance Education?"
"Viviane Meireles","Generalizador Neural de Espaços de Aprendizagem em Sistemas Tutores Inteligentes"
"Volia Volia de Almeida Carvalho","Um Ambiente Baseado na WEB 2.0 para Atividades de Simulação na Educação Médica Construtivista"
"Wagner Saback Dantas","A experiência do Projeto Classificação de Software Livre Educativo (CLASSE)"
"Walker Rabelo","Recuperação de Informações Web para um Ambiente de Aprendizagem Computadorizada: uma Abordagem Multiagentes"
"Wallace Ugulino","Templates para Colaboração:  Recomendações de Planejamentos para Dinâmicas de Grupo"
"Werner Haetinger","Controle de Kit de Robótica através de Laboratório Remoto pela Internet: uma Aplicação para a Formação Docente e para a Educação Básica"
"Windson Viana","A Utilização de Dispositivos Móveis com Ambientes Tridimensionais como Ferramenta para Favorecer o Ensino de Hardware"
