"Louise J. Seixas","Agente mediador para seleção de estratégias pedagógicas em um ambiente multiagente de aprendizagem"
"Louise Jeanty de Seixas","Aplicação de estratégias de construção de conhecimento em um ambiente probabilístico de aprendizagem"
"Lourenço de O. Basso","A escrita coletiva de hipertextos com links multidirecionais através do Co-Link Wiki em procesos educacionais"
"Lucas T. Alves","Implementação de Compilador e Ambiente de Programação Icônica para a Linguagem Logo em um Ambiente de Robótica Pedagógica de Baixo Custo"
"Lucia Barcellos Bazzarella","Educação a distância no Ensino Superior – Uma proposta baseada em Comunidades de Aprendizagem usando Ambientes Telemáticos"
"Lucia Giraffa","Modelando um ambiente de aprendizagem na Web: a importância de formalização do processo de desenvolvimento"
"Lucia M. M. Giraffa","Utilizando a tecnologia de agentes na construção de Sistemas Tutores inteligentes em ambiente interativo"
"Lucia Maria Giraffa","Modelando Ambientes de Aprendizagem Virtuais utilizando Role-Playing Games"
"Lúcia Maria Martins Giraffa","Uma Arquitetura de Tutor para Promover Experiências de Aprendizagem Mediadas"
"Lúcia Regina Goulart Vilarinho","FORMAÇÃO CONTINUADA DE PROFESSORES EM CURSOS ON-LINE: NOVAS PERSPECTIVAS NO PROCESSO ENSINO-APRENDIZAGEM?"
"Luciana Alvim Santos Romani","Contribuições de conceitos de comunicação mediada por computadores e visualização de informação para o desenvolvimento de ambientes de aprendizagem colaborativa"
"Luciana Backes","ECoDI: A criação de um Espaço de Convivência Digital Virtual"
"Luciana de Lima","A Utilização de Dispositivos Móveis com Ambientes Tridimensionais como Ferramenta para Favorecer o Ensino de Hardware"
"Luciana Frasson Mesquita","Percepção em Comunidades Virtuais: Mantendo-se Antenado no AmCorA"
"Luciana P. Nedel","Sistema de Animação de Humanos Virtuais Voltado para o Ensino de Libras"
"Luciana S. Soprani","Ambientes de autoria, aplicação de testes e apoios a avaliações psicológicas"
"Luciane M. Fraga","Guilly - Um Agente Pedagógico Animado para o AVEI"
"Maria G. M. Silva","A Internet no contexto escolar: uma mídia pedagógica para promover a inclusão digital e social de alunos do ensino fundamental"
"Maria Helena L. B. Braz","Improving Collaborative Learning Processes by Using Structured Information"
"Maria Helena Pamplona","ANÁLISE DE AVALIAÇÃO: CONTRIBUIÇÕES DE UMA FERRAMENTA DE FÓRUM PARA O ENSINO DE FÍSICA NO NÍVEL MÉDIO"
"Orlando Fonseca Silva","Experimento de Controle Colaborativo em Ambiente Virtual Tridimensional"
"Oswaldo Bassani Neto","PORTAL EDUMUSICAL: Telemática aplicada à Educação Musical"
"Otacílio José Pereira","O uso de ontologias como um instrumento de avaliação de ferramentas de comunicação mediada por computador"
"Paola Vargas Barbosa","Dimensão Sócio-Afetiva da Interação à Distância"
"Parcilene Fernandes de Brito","Uma Estrutura para Definição de Seqüências de Estudos Baseada na Técnica Ant System"
"Patric da S. Ribeiro","Validação de um Ambiente de Aprendizagem Móvel em Curso a Distância"
"Patricia A. Behar","Investigando a subjetividade afetiva na comunicação assíncrona de ambientes virtuais de aprendizagem"
"Patrícia A. Jaques","Considerando os fatores sócio-afetivos personalidade e liderança em ambientes de ensino-aprendizagem colaborativos assistidos por computador"
"Patricia A. Rodrigues","Tarefa Interativa: uma proposta flexível de interatividade para o Moodle"
"Roberto Castro","Avaliando os alunos com deficiência mental educável através do método de Reuven Feuerstein em ambiente informatizado"
"Roxane Leandra dos Santos Miranda","Construção Coletiva de Livros Multimídia: Uma Abordagem para Temas Transversais"
"Taís Rabetti Gianella",""SEMINÁRIO DE EDUCAÇÃO A DISTÂNCIA NA ÁREA DA SAÚDE": UMA EXPERIÊNCIA DE APRENDIZAGEM ONLINE"
