Ubaldo Tonar Teixeira Góes,Desenvolvimento da Aprendizagem Significativa de  Eletricidade com o Auxílio Pedagógico de Simulação  Computacional de Circuitos de Resistores Elétricos
Urbanno Leite,Proposta de um Ambiente Computacional que Auxilia na Detecção de Sintomas da Dislexia
Úrsula A. L. F. Ribeiro,Agentificando um Ambiente de Aprendizagem de Matemática
Úrsula A. L. Fernandes Ribeiro,Construindo um Sistema Tutor Inteligente a partir de um Tutorial
V. Lessa,Programação de Computadores e Robótica Educativa na Escola: tendências evidenciadas nas produções do Workshop de Informática na Escola
Valdeci B. de Melo Oliveira,Uso de Software Livre na preservação das manifestações culturais de adolescentes que habitam as periferias e bolsões de miséria em Cascavel-PR
Valdinei F. Silva,Camada de Interoperabilidade entre o Ambiente de Aprendizagem TIDIA-Ae e Ambientes Virtuais Tridimensionais
Valéria dos Santos Schinato,Uso de Software Livre na preservação das manifestações culturais de adolescentes que habitam as periferias e bolsões de miséria em Cascavel-PR
Valéria Inês Tanajura Lôbo,DE TUTOR A PROFESSOR ON LINE: QUE SUJEITO É ESSE?
Valéria Machado da Costa,Avaliação de sites educacionais de Química e Física: um estudo comparativo
Valéria Pinheiro Raymundo,Objeto pedagógico virtual sobre Processo de Coordenação
Vanda Arantes Araújo,Ambientes virtuais de aprendizagem e o modelo TPACK: relato de experiência de oferta de cursos em diferentes plataformas de educação a distância
Vander Luiz Aguiar,Uma Reflexão Sobre Acesso do Deficiente Visual à Educação na Região Centro-Oeste de Minas Gerais
Vandor R. V. Rissoli,Sistema Tutor Inteligente integrado a Monitoria Estudantil para elaboração de um Assistente Virtual de Ensino Inteligente
Vanessa C. Marinho,O CENÁRIO DO USO DAS TECNOLOGIAS NA ESCOLA DO SÉCULO XXI
Vanessa Corado,Impactos da implantação do sistema informatizado para processo de seleção do PNAES no IFTO Campus Porto Nacional
Vanessa da Silva Ferreira,Uma modelagem conceitual para apoiar a identificação das causas da evasão escolar em EAD
Vanessa Dantas,Formação Tecnológica de Professores do Município de Rio Tinto: Um Relato de Experiência
Vanessa G. Tonet,Interação Virtual para aprendizagem de Matemática
Vanessa Maia A. de Magalhães,Níveis de letramento e equivalentes textuais culturalmente adaptados na educação continuada e inclusiva
Vanessa Maia Aguiar de Magalhães,O Uso de um Jogo Narrativo Computacional em um Ambiente Escolar
Vanessa pt_BR Nunes,doi
Vânia Cordeiro da Silva,Aprendendo Conceitos de Computação Gráfica através de um Ambiente Multimídia e Interativo com OpenGL
Vânia Marins Nobre,Comunidades de prática e ferramentas Web 2.0: uma experiência em um curso de especialização em Matemática
Vera Lúcia da Silveira Nantes Button,Sistema Automatizado de Transcrição de Textos Escritos no Sistema Braille para Textos Escritos no Sistema Óptico em Língua Portuguesa
Vera Lúcia Duarte de Novais,A cultura escolar e a inserção das TICs: dificuldades e oportunidades
Vera Lúcia Ruiz Rodrigues da Silva,Sistema Web para Cadastramento e Consulta de Materiais Disponibilizados pelo PEE-UNIOESTE
Veronica dos Santos,Linguagem de Programação e a elaboração de discursos científicos
Verônica Maria Lavor da Silva,Objeto de Aprendizagem Gangorra Interativa na Compreensão Conceitual de Grandezas
Victor F. de A. Barros,Avaliação do Destino do Lixo Eletrônico do Município de Inhumas
Victor H. P. Gomes,doi
Vilma F. de França,"Avaliação Contínua da Aprendizagem, das Competências e Habilidades em Programação de Computadores"
Vilmar Pedro Votre,Integração Disciplinar em um Curso de Graduação com o uso de Ontologias
Vinícius A. Rodrigues,Um Ambiente Interativo de Aprendizagem para o ensino de programação na Universidade de Brasília
Vinicius C. Garcia,Um Mapeamento Sistemático para Problem Based Learning aplicado à Ciência da Computação
Vinícius Pereira Faria,"Apresentação e Avaliação do Jogo ""Trânsito Consciente"": Um Jogo Educacional Móvel de Auxílio à Conscientização sobre os Riscos de se Dirigir sob Efeito de Álcool"
Vinicius Pinheiro,Onda Digital: A Universidade protagonizando a Inclusão Digital
Vinícius Ribeiro Zuquim,Uma Análise Crítica Da Influência Da Linguagem Da Internet No Cotidiano Do Interlocutor
Virgínia Caldas Machado,"Aprendizagem Inter/Transdisciplinar das Áreas de Informática, Inglês e Ciências: construção do conhecimento através de aplicativos digitais livres"
Vítor de Oliveira Batista,"Concordo, Discordo ou Depende – Assim é o Fórum da Controvérsia Acadêmica"
Viviane Azevedo,Mediação de Debate Educacional via Bate-papo:  o Problema da Coordenação dos Assuntos
Viviane Gomes da Silva,Uma Experiência de “Virtualização” de Disciplina em Cursos de Graduação
Waldemar Mazza Silva,A influência da utilização do Orkut e Messenger no processo de Ensino de Matemática com alunos do Ensino Médio da Rede Pública
Waldiney Bolgheroni,Software Livre Aplicado ao Ensino de Geometria e Desenho Geométrico
Waldiza Salgado Santos,II oficina de tutoria em ambientes virtuais de aprendizagem (Tutava): um relato de experiência formativa de recursos humanos para EAD
Wallace Ugulino,Em Busca de Melhores MODUS de Realizar  Dinâmicas Educacionais Colaborativas
Wamberto Lima,Formação Continuada de Professores para as TIC: Análise a Partir dos Cursos Ofertados pelo NTE-Natal
Wdson Costa,Big Bang: Uma Ferramenta para Ensino-Aprendizado da Classificação Periódica dos Elementos Químicos
Wederson Xavier de Araújo,"Informática Aplicada à Educação nas Escolas Públicas: Estudos e Perspectivas de Parcerias com o Instituto Federal de Goiás, Campus Inhumas"
Wellington Wagner Ferreira Sarmento,Videoconferência: a Experiência da Formação de Gestores de Novas Tecnologias da Informação e Comunicação
Wendell Oliveira,Investigando dois formatos de videoaulas de programação de jogos digitais para alunos do ensino médio
Wendell Pimenta Cunha,BAIUKA – Um jogo educativo infantil usando agentes inteligentes na avaliação das inteligências múltiplas
Wênder A. Lima,SCATeDi: Sistema Inteligente para Avaliação de Desempenho Escolar em Avaliações Discursivas
Wilk Oliveira dos Santos,Jogos Educacionais como Ferramenta de Auxílio em Sala de Aula
William Lautenshlager,Sistema de Autoria e Tutor Inteligente – SATI : Desenvolvimento e Validação na Formação Continuada
Wine Silva,Proposta de atividade para o quinto ano do ensino fundamental: Algoritmos Desplugados
Yandre M. G. da Costa,Whiteboard interativo de baixo custo: uma alternativa viável para as escolas brasileiras
Ygor Nakamura,Robótica Educacional em Prol do Ensino de Matemática
Yuri A. N. Maia,Um Ambiente Interativo de Aprendizagem para o ensino de programação na Universidade de Brasília
Yvina Pavan Baldo,O uso da ferramenta cognitiva Fórum no processo de ensino-aprendizagem na modalidade a distância
Zeina Rebouças Corrêa Thomé,Inclusão Social e Digital através da Formação para o Trabalho
Zildomar Felix,Proposta de um Ambiente Computacional que Auxilia na Detecção de Sintomas da Dislexia
